NAME	GS<br> follow link to MSigDB	GS DETAILS	SIZE	ES	NES	NOM p-val	FDR q-val	FWER p-val	RANK AT MAX	LEADING EDGE	
CHROMATIN MODIFICATIONS DURING THE MATERNAL TO ZYGOTIC TRANSITION (MZT)%REACTOME%R-HSA-9821002.1	CHROMATIN MODIFICATIONS DURING THE MATERNAL TO ZYGOTIC TRANSITION (MZT)%REACTOME%R-HSA-9821002.1	Details ...	30	0.73926747	2.070156	0.0	0.035156496	0.032	2315	tags=50%, list=12%, signal=57%	
HALLMARK_ESTROGEN_RESPONSE_EARLY%MSIGDBHALLMARK%HALLMARK_ESTROGEN_RESPONSE_EARLY	HALLMARK_ESTROGEN_RESPONSE_EARLY%MSIGDBHALLMARK%HALLMARK_ESTROGEN_RESPONSE_EARLY	Details ...	168	0.55395067	2.0346494	0.0	0.03901318	0.07	1364	tags=33%, list=7%, signal=35%	
CONDENSATION OF PROPHASE CHROMOSOMES%REACTOME DATABASE ID RELEASE 91%2299718	CONDENSATION OF PROPHASE CHROMOSOMES%REACTOME DATABASE ID RELEASE 91%2299718	Details ...	34	0.6973347	2.0254714	0.0	0.03204067	0.0845	2772	tags=50%, list=15%, signal=59%	
ASSEMBLY OF THE ORC COMPLEX AT THE ORIGIN OF REPLICATION%REACTOME%R-HSA-68616.6	ASSEMBLY OF THE ORC COMPLEX AT THE ORIGIN OF REPLICATION%REACTOME%R-HSA-68616.6	Details ...	31	0.71498775	2.0094972	0.0	0.03392838	0.117	3467	tags=58%, list=18%, signal=71%	
RNA POLYMERASE I PROMOTER OPENING%REACTOME%R-HSA-73728.4	RNA POLYMERASE I PROMOTER OPENING%REACTOME%R-HSA-73728.4	Details ...	25	0.7362451	1.9980377	0.0	0.03438699	0.146	2315	tags=56%, list=12%, signal=64%	
RECOGNITION AND ASSOCIATION OF DNA GLYCOSYLASE WITH SITE CONTAINING AN AFFECTED PYRIMIDINE%REACTOME DATABASE ID RELEASE 91%110328	RECOGNITION AND ASSOCIATION OF DNA GLYCOSYLASE WITH SITE CONTAINING AN AFFECTED PYRIMIDINE%REACTOME DATABASE ID RELEASE 91%110328	Details ...	34	0.6871827	1.9814956	0.0	0.040809616	0.2	2772	tags=50%, list=15%, signal=59%	
HUMORAL IMMUNE RESPONSE%GOBP%GO:0006959	HUMORAL IMMUNE RESPONSE%GOBP%GO:0006959	Details ...	88	0.5778819	1.98024	0.0	0.03576066	0.204	1677	tags=26%, list=9%, signal=29%	
DEPYRIMIDINATION%REACTOME DATABASE ID RELEASE 91%73928	DEPYRIMIDINATION%REACTOME DATABASE ID RELEASE 91%73928	Details ...	34	0.6871827	1.9710416	0.0	0.03875234	0.2465	2772	tags=50%, list=15%, signal=59%	
CHEMOKINE-MEDIATED SIGNALING PATHWAY%GOBP%GO:0070098	CHEMOKINE-MEDIATED SIGNALING PATHWAY%GOBP%GO:0070098	Details ...	29	0.7104995	1.9678191	0.0	0.03682241	0.2605	2145	tags=48%, list=11%, signal=54%	
MYELOID LEUKOCYTE MIGRATION%GOBP%GO:0097529	MYELOID LEUKOCYTE MIGRATION%GOBP%GO:0097529	Details ...	51	0.6256395	1.9563411	0.0	0.04083249	0.308	1995	tags=29%, list=11%, signal=33%	
MEIOTIC RECOMBINATION%REACTOME DATABASE ID RELEASE 91%912446	MEIOTIC RECOMBINATION%REACTOME DATABASE ID RELEASE 91%912446	Details ...	48	0.63309723	1.9489003	0.0	0.041660395	0.3395	2906	tags=40%, list=15%, signal=47%	
CLEAVAGE OF THE DAMAGED PYRIMIDINE%REACTOME DATABASE ID RELEASE 91%110329	CLEAVAGE OF THE DAMAGED PYRIMIDINE%REACTOME DATABASE ID RELEASE 91%110329	Details ...	34	0.6871827	1.9434738	0.0	0.041767105	0.3635	2772	tags=50%, list=15%, signal=59%	
OMEGA 6 FATTY ACIDS IN SENESCENCE%WIKIPATHWAYS_20250210%WP5424%HOMO SAPIENS	OMEGA 6 FATTY ACIDS IN SENESCENCE%WIKIPATHWAYS_20250210%WP5424%HOMO SAPIENS	Details ...	27	0.71514887	1.9407603	0.0	0.040237967	0.3755	1522	tags=37%, list=8%, signal=40%	
REGULATION OF HOMOTYPIC CELL-CELL ADHESION%GOBP%GO:0034110	REGULATION OF HOMOTYPIC CELL-CELL ADHESION%GOBP%GO:0034110	Details ...	28	0.72074926	1.940595	9.794319E-4	0.03759903	0.3775	1430	tags=29%, list=8%, signal=31%	
RESPONSE TO CHEMOKINE%GOBP%GO:1990868	RESPONSE TO CHEMOKINE%GOBP%GO:1990868	Details ...	35	0.6672816	1.9391783	9.285051E-4	0.036225054	0.388	2145	tags=43%, list=11%, signal=48%	
REGULATION OF ENDOGENOUS RETROELEMENTS BY THE HUMAN SILENCING HUB (HUSH) COMPLEX%REACTOME%R-HSA-9843970.1	REGULATION OF ENDOGENOUS RETROELEMENTS BY THE HUMAN SILENCING HUB (HUSH) COMPLEX%REACTOME%R-HSA-9843970.1	Details ...	33	0.68259054	1.9327964	0.0	0.03793441	0.4275	2315	tags=45%, list=12%, signal=52%	
POSITIVE REGULATION OF RECEPTOR SIGNALING PATHWAY VIA STAT%GOBP%GO:1904894	POSITIVE REGULATION OF RECEPTOR SIGNALING PATHWAY VIA STAT%GOBP%GO:1904894	Details ...	30	0.6909358	1.9326599	0.0	0.035702974	0.4275	1517	tags=27%, list=8%, signal=29%	
DNA METHYLATION%REACTOME DATABASE ID RELEASE 91%5334118	DNA METHYLATION%REACTOME DATABASE ID RELEASE 91%5334118	Details ...	26	0.7214184	1.9301533	0.0	0.03570166	0.447	2315	tags=54%, list=12%, signal=61%	
PACKAGING OF TELOMERE ENDS%REACTOME DATABASE ID RELEASE 91%171306	PACKAGING OF TELOMERE ENDS%REACTOME DATABASE ID RELEASE 91%171306	Details ...	26	0.7145043	1.9285828	0.0	0.034922063	0.457	2772	tags=54%, list=15%, signal=63%	
ACTIVATION OF BH3-ONLY PROTEINS%REACTOME%R-HSA-114452.5	ACTIVATION OF BH3-ONLY PROTEINS%REACTOME%R-HSA-114452.5	Details ...	30	0.69168174	1.9278382	9.285051E-4	0.033614006	0.461	2256	tags=40%, list=12%, signal=45%	
ICOSANOID BIOSYNTHETIC PROCESS%GOBP%GO:0046456	ICOSANOID BIOSYNTHETIC PROCESS%GOBP%GO:0046456		32	0.68977386	1.9273816	9.4161957E-4	0.032353163	0.466	1522	tags=31%, list=8%, signal=34%	
CELLULAR RESPONSE TO CHEMOKINE%GOBP%GO:1990869	CELLULAR RESPONSE TO CHEMOKINE%GOBP%GO:1990869		35	0.6672816	1.9225756	0.0	0.03365973	0.491	2145	tags=43%, list=11%, signal=48%	
INHIBITION OF DNA RECOMBINATION AT TELOMERE%REACTOME DATABASE ID RELEASE 91%9670095	INHIBITION OF DNA RECOMBINATION AT TELOMERE%REACTOME DATABASE ID RELEASE 91%9670095		41	0.65696543	1.9199275	0.0	0.033897277	0.511	2315	tags=34%, list=12%, signal=39%	
DEFECTIVE PYROPTOSIS%REACTOME%R-HSA-9710421.5	DEFECTIVE PYROPTOSIS%REACTOME%R-HSA-9710421.5		35	0.67383444	1.9149821	9.1240875E-4	0.035683107	0.546	2957	tags=46%, list=16%, signal=54%	
COMPLEMENT ACTIVATION%GOBP%GO:0006956	COMPLEMENT ACTIVATION%GOBP%GO:0006956		24	0.71912044	1.9119716	0.0	0.03605315	0.563	3638	tags=58%, list=19%, signal=72%	
GRANULOCYTE CHEMOTAXIS%GOBP%GO:0071621	GRANULOCYTE CHEMOTAXIS%GOBP%GO:0071621		32	0.69031674	1.9095381	9.11577E-4	0.036354188	0.5785	1995	tags=38%, list=11%, signal=42%	
GRANULOCYTE MIGRATION%GOBP%GO:0097530	GRANULOCYTE MIGRATION%GOBP%GO:0097530		37	0.64745545	1.906078	9.276438E-4	0.037037935	0.6	1995	tags=32%, list=11%, signal=36%	
PRC2 METHYLATES HISTONES AND DNA%REACTOME%R-HSA-212300.3	PRC2 METHYLATES HISTONES AND DNA%REACTOME%R-HSA-212300.3		35	0.66120195	1.9017358	9.066183E-4	0.038401622	0.6285	2315	tags=40%, list=12%, signal=46%	
INTERLEUKIN-2 FAMILY SIGNALING%REACTOME DATABASE ID RELEASE 91%451927	INTERLEUKIN-2 FAMILY SIGNALING%REACTOME DATABASE ID RELEASE 91%451927		34	0.65764016	1.8958952	0.0	0.040961333	0.6615	2145	tags=29%, list=11%, signal=33%	
BASE-EXCISION REPAIR, AP SITE FORMATION%REACTOME DATABASE ID RELEASE 91%73929	BASE-EXCISION REPAIR, AP SITE FORMATION%REACTOME DATABASE ID RELEASE 91%73929		35	0.6621526	1.8869416	0.0	0.046240807	0.7165	2772	tags=49%, list=15%, signal=57%	
CLEAVAGE OF THE DAMAGED PURINE%REACTOME DATABASE ID RELEASE 91%110331	CLEAVAGE OF THE DAMAGED PURINE%REACTOME DATABASE ID RELEASE 91%110331		29	0.6801879	1.8865919	9.3720714E-4	0.044979833	0.7205	2772	tags=52%, list=15%, signal=61%	
DEPURINATION%REACTOME DATABASE ID RELEASE 91%73927	DEPURINATION%REACTOME DATABASE ID RELEASE 91%73927		29	0.6801879	1.8798317	0.0037664783	0.048526682	0.7635	2772	tags=52%, list=15%, signal=61%	
SIRT1 NEGATIVELY REGULATES RRNA EXPRESSION%REACTOME DATABASE ID RELEASE 91%427359	SIRT1 NEGATIVELY REGULATES RRNA EXPRESSION%REACTOME DATABASE ID RELEASE 91%427359		30	0.6778819	1.8755742	0.0	0.05021714	0.7865	2315	tags=47%, list=12%, signal=53%	
RECOGNITION AND ASSOCIATION OF DNA GLYCOSYLASE WITH SITE CONTAINING AN AFFECTED PURINE%REACTOME DATABASE ID RELEASE 91%110330	RECOGNITION AND ASSOCIATION OF DNA GLYCOSYLASE WITH SITE CONTAINING AN AFFECTED PURINE%REACTOME DATABASE ID RELEASE 91%110330		29	0.6801879	1.8729391	0.0	0.05093461	0.8055	2772	tags=52%, list=15%, signal=61%	
HALLMARK_APICAL_SURFACE%MSIGDBHALLMARK%HALLMARK_APICAL_SURFACE	HALLMARK_APICAL_SURFACE%MSIGDBHALLMARK%HALLMARK_APICAL_SURFACE		38	0.648255	1.8722495	0.0	0.05012302	0.8085	986	tags=34%, list=5%, signal=36%	
UNSATURATED FATTY ACID METABOLIC PROCESS%GOBP%GO:0033559	UNSATURATED FATTY ACID METABOLIC PROCESS%GOBP%GO:0033559		75	0.5645207	1.869651	0.0	0.050852176	0.8185	1150	tags=27%, list=6%, signal=28%	
PHOSPHORYLATION OF CD3 AND TCR ZETA CHAINS%REACTOME%R-HSA-202427.8	PHOSPHORYLATION OF CD3 AND TCR ZETA CHAINS%REACTOME%R-HSA-202427.8		15	0.79102534	1.8684797	0.002895753	0.050453737	0.8215	1139	tags=33%, list=6%, signal=35%	
SENESCENCE-ASSOCIATED SECRETORY PHENOTYPE (SASP)%REACTOME DATABASE ID RELEASE 91%2559582	SENESCENCE-ASSOCIATED SECRETORY PHENOTYPE (SASP)%REACTOME DATABASE ID RELEASE 91%2559582		71	0.570489	1.8683531	0.0	0.049198084	0.822	2900	tags=32%, list=15%, signal=38%	
HALLMARK_ESTROGEN_RESPONSE_LATE%MSIGDBHALLMARK%HALLMARK_ESTROGEN_RESPONSE_LATE	HALLMARK_ESTROGEN_RESPONSE_LATE%MSIGDBHALLMARK%HALLMARK_ESTROGEN_RESPONSE_LATE		159	0.50623417	1.8682134	0.0	0.047992535	0.822	1713	tags=30%, list=9%, signal=33%	
MHC PROTEIN COMPLEX ASSEMBLY%GOBP%GO:0002396	MHC PROTEIN COMPLEX ASSEMBLY%GOBP%GO:0002396		17	0.75241476	1.8626295	0.0030181087	0.050665725	0.846	1139	tags=35%, list=6%, signal=38%	
POSITIVE REGULATION OF RECEPTOR SIGNALING PATHWAY VIA JAK-STAT%GOBP%GO:0046427	POSITIVE REGULATION OF RECEPTOR SIGNALING PATHWAY VIA JAK-STAT%GOBP%GO:0046427		25	0.69301826	1.8567463	0.0	0.053914145	0.8695	2145	tags=32%, list=11%, signal=36%	
DOPAMINE NEUROTRANSMITTER RELEASE CYCLE%REACTOME DATABASE ID RELEASE 91%212676	DOPAMINE NEUROTRANSMITTER RELEASE CYCLE%REACTOME DATABASE ID RELEASE 91%212676		22	0.7167932	1.8545545	9.5238094E-4	0.0543666	0.8765	1842	tags=32%, list=10%, signal=35%	
PEPTIDE ANTIGEN ASSEMBLY WITH MHC PROTEIN COMPLEX%GOBP%GO:0002501	PEPTIDE ANTIGEN ASSEMBLY WITH MHC PROTEIN COMPLEX%GOBP%GO:0002501		17	0.75241476	1.8512244	0.0019900498	0.0560793	0.89	1139	tags=35%, list=6%, signal=38%	
OVERVIEW OF PROINFLAMMATORY AND PROFIBROTIC MEDIATORS%WIKIPATHWAYS_20250210%WP5095%HOMO SAPIENS	OVERVIEW OF PROINFLAMMATORY AND PROFIBROTIC MEDIATORS%WIKIPATHWAYS_20250210%WP5095%HOMO SAPIENS		31	0.66736865	1.8509816	0.001858736	0.054979358	0.8905	986	tags=26%, list=5%, signal=27%	
VERY LONG-CHAIN FATTY ACID METABOLIC PROCESS%GOBP%GO:0000038	VERY LONG-CHAIN FATTY ACID METABOLIC PROCESS%GOBP%GO:0000038		27	0.6846667	1.8500133	0.0	0.054805633	0.8945	1150	tags=26%, list=6%, signal=28%	
MONONUCLEAR CELL PROLIFERATION%GOBP%GO:0032943	MONONUCLEAR CELL PROLIFERATION%GOBP%GO:0032943		26	0.6859142	1.8480479	0.0018604652	0.055354815	0.904	3000	tags=54%, list=16%, signal=64%	
IL2 SIGNALING EVENTS MEDIATED BY STAT5%PATHWAY INTERACTION DATABASE NCI-NATURE CURATED DATA%IL2 SIGNALING EVENTS MEDIATED BY STAT5	IL2 SIGNALING EVENTS MEDIATED BY STAT5%PATHWAY INTERACTION DATABASE NCI-NATURE CURATED DATA%IL2 SIGNALING EVENTS MEDIATED BY STAT5		24	0.68951076	1.8421595	0.0028195488	0.059091743	0.921	1710	tags=21%, list=9%, signal=23%	
ADAPTIVE IMMUNE RESPONSE BASED ON SOMATIC RECOMBINATION OF IMMUNE RECEPTORS BUILT FROM IMMUNOGLOBULIN SUPERFAMILY DOMAINS%GOBP%GO:0002460	ADAPTIVE IMMUNE RESPONSE BASED ON SOMATIC RECOMBINATION OF IMMUNE RECEPTORS BUILT FROM IMMUNOGLOBULIN SUPERFAMILY DOMAINS%GOBP%GO:0002460		66	0.57753325	1.8408116	8.9206063E-4	0.059085432	0.925	3202	tags=33%, list=17%, signal=40%	
INTERLEUKIN-10 SIGNALING%REACTOME%R-HSA-6783783.5	INTERLEUKIN-10 SIGNALING%REACTOME%R-HSA-6783783.5		28	0.66616833	1.8368903	9.6432015E-4	0.061496977	0.935	392	tags=18%, list=2%, signal=18%	
PD-1 SIGNALING%REACTOME%R-HSA-389948.6	PD-1 SIGNALING%REACTOME%R-HSA-389948.6		16	0.75643826	1.83628	9.6525095E-4	0.060882818	0.936	1139	tags=31%, list=6%, signal=33%	
ACTIVATED PKN1 STIMULATES TRANSCRIPTION OF AR (ANDROGEN RECEPTOR) REGULATED GENES KLK2 AND KLK3%REACTOME%R-HSA-5625886.3	ACTIVATED PKN1 STIMULATES TRANSCRIPTION OF AR (ANDROGEN RECEPTOR) REGULATED GENES KLK2 AND KLK3%REACTOME%R-HSA-5625886.3		27	0.6777248	1.8353791	0.001908397	0.060388923	0.9375	2315	tags=52%, list=12%, signal=59%	
REGULATION OF RECEPTOR SIGNALING PATHWAY VIA STAT%GOBP%GO:1904892	REGULATION OF RECEPTOR SIGNALING PATHWAY VIA STAT%GOBP%GO:1904892		54	0.5939023	1.8351367	0.0	0.05946002	0.939	2145	tags=28%, list=11%, signal=31%	
ACTIVATION OF BAD AND TRANSLOCATION TO MITOCHONDRIA%REACTOME%R-HSA-111447.5	ACTIVATION OF BAD AND TRANSLOCATION TO MITOCHONDRIA%REACTOME%R-HSA-111447.5		15	0.7767647	1.831384	0.0019249278	0.061747633	0.95	1869	tags=53%, list=10%, signal=59%	
IL12-MEDIATED SIGNALING EVENTS%PATHWAY INTERACTION DATABASE NCI-NATURE CURATED DATA%IL12-MEDIATED SIGNALING EVENTS	IL12-MEDIATED SIGNALING EVENTS%PATHWAY INTERACTION DATABASE NCI-NATURE CURATED DATA%IL12-MEDIATED SIGNALING EVENTS		39	0.61872184	1.8311365	0.001826484	0.06080766	0.951	1905	tags=31%, list=10%, signal=34%	
ICOSANOID METABOLIC PROCESS%GOBP%GO:0006690	ICOSANOID METABOLIC PROCESS%GOBP%GO:0006690		75	0.5541956	1.8297381	0.0	0.060862135	0.952	1958	tags=28%, list=10%, signal=31%	
POSITIVE REGULATION OF PROTEIN MATURATION%GOBP%GO:1903319	POSITIVE REGULATION OF PROTEIN MATURATION%GOBP%GO:1903319		19	0.72635734	1.8230717	0.003875969	0.06583587	0.9635	3409	tags=58%, list=18%, signal=71%	
ANTIGEN PROCESSING AND PRESENTATION OF PEPTIDE ANTIGEN%GOBP%GO:0048002	ANTIGEN PROCESSING AND PRESENTATION OF PEPTIDE ANTIGEN%GOBP%GO:0048002		54	0.5787346	1.8209695	0.0	0.06666462	0.9665	1139	tags=20%, list=6%, signal=22%	
POSITIVE REGULATION OF PROTEIN PROCESSING%GOBP%GO:0010954	POSITIVE REGULATION OF PROTEIN PROCESSING%GOBP%GO:0010954		18	0.73025286	1.8207055	0.0	0.06577161	0.9665	3409	tags=61%, list=18%, signal=75%	
PID_IL2_STAT5_PATHWAY%MSIGDB_C2%PID_IL2_STAT5_PATHWAY	PID_IL2_STAT5_PATHWAY%MSIGDB_C2%PID_IL2_STAT5_PATHWAY		21	0.7101614	1.8174894	0.003925417	0.06763332	0.9685	1710	tags=24%, list=9%, signal=26%	
PEPTIDE LIGAND-BINDING RECEPTORS%REACTOME%R-HSA-375276.8	PEPTIDE LIGAND-BINDING RECEPTORS%REACTOME%R-HSA-375276.8		86	0.53608096	1.8099015	0.0	0.07423289	0.982	1815	tags=27%, list=10%, signal=29%	
GLYCOSYL COMPOUND CATABOLIC PROCESS%GOBP%GO:1901658	GLYCOSYL COMPOUND CATABOLIC PROCESS%GOBP%GO:1901658		17	0.73669124	1.8086421	0.003003003	0.07437404	0.9835	3142	tags=53%, list=17%, signal=63%	
MONONUCLEAR CELL MIGRATION%GOBP%GO:0071674	MONONUCLEAR CELL MIGRATION%GOBP%GO:0071674		51	0.58136517	1.8080506	0.0017953322	0.07376711	0.984	1546	tags=29%, list=8%, signal=32%	
B CELL RECEPTOR SIGNALING PATHWAY%GOBP%GO:0050853	B CELL RECEPTOR SIGNALING PATHWAY%GOBP%GO:0050853		31	0.6438982	1.8041255	0.0019138756	0.07645532	0.987	3825	tags=52%, list=20%, signal=65%	
INTERFERON GAMMA SIGNALING%REACTOME DATABASE ID RELEASE 91%877300	INTERFERON GAMMA SIGNALING%REACTOME DATABASE ID RELEASE 91%877300		84	0.5334752	1.801848	8.5984526E-4	0.07756201	0.9895	1324	tags=23%, list=7%, signal=24%	
ACTIVATION OF RRNA EXPRESSION BY ERCC6 (CSB) AND EHMT2 (G9A)%REACTOME DATABASE ID RELEASE 91%427389	ACTIVATION OF RRNA EXPRESSION BY ERCC6 (CSB) AND EHMT2 (G9A)%REACTOME DATABASE ID RELEASE 91%427389		38	0.61216044	1.79946	0.0018018018	0.078885384	0.9905	2315	tags=42%, list=12%, signal=48%	
LEUKOTRIENE METABOLIC PROCESS%GOBP%GO:0006691	LEUKOTRIENE METABOLIC PROCESS%GOBP%GO:0006691		16	0.7454609	1.7925936	0.0058083255	0.08532353	0.9935	1454	tags=38%, list=8%, signal=41%	
LYMPHOCYTE PROLIFERATION%GOBP%GO:0046651	LYMPHOCYTE PROLIFERATION%GOBP%GO:0046651		25	0.66886944	1.7901419	0.0037488285	0.08704047	0.9935	3000	tags=52%, list=16%, signal=62%	
COMPLEMENT CASCADE%REACTOME DATABASE ID RELEASE 91%166658	COMPLEMENT CASCADE%REACTOME DATABASE ID RELEASE 91%166658		37	0.62078446	1.7896501	9.13242E-4	0.08636527	0.9935	3638	tags=46%, list=19%, signal=57%	
CHEMOKINE RECEPTORS BIND CHEMOKINES%REACTOME DATABASE ID RELEASE 91%380108	CHEMOKINE RECEPTORS BIND CHEMOKINES%REACTOME DATABASE ID RELEASE 91%380108		25	0.66693646	1.7872717	0.006616257	0.08785939	0.9935	1995	tags=40%, list=11%, signal=45%	
REGULATION OF CYCLIN-DEPENDENT PROTEIN SERINE/THREONINE KINASE ACTIVITY%GOBP%GO:0000079	REGULATION OF CYCLIN-DEPENDENT PROTEIN SERINE/THREONINE KINASE ACTIVITY%GOBP%GO:0000079		46	0.58826	1.7864699	0.0	0.08740386	0.995	2599	tags=26%, list=14%, signal=30%	
REGULATION OF RECEPTOR SIGNALING PATHWAY VIA JAK-STAT%GOBP%GO:0046425	REGULATION OF RECEPTOR SIGNALING PATHWAY VIA JAK-STAT%GOBP%GO:0046425		47	0.5854279	1.7860564	0.0027347312	0.08666612	0.995	2145	tags=28%, list=11%, signal=31%	
RHO GTPASES ACTIVATE PKNS%REACTOME%R-HSA-5625740.3	RHO GTPASES ACTIVATE PKNS%REACTOME%R-HSA-5625740.3		54	0.5737069	1.7857823	9.0252707E-4	0.085743904	0.995	2782	tags=48%, list=15%, signal=56%	
DISEASES OF PROGRAMMED CELL DEATH%REACTOME%R-HSA-9645723.8	DISEASES OF PROGRAMMED CELL DEATH%REACTOME%R-HSA-9645723.8		63	0.55936134	1.7840414	8.9206063E-4	0.08643407	0.9955	2957	tags=37%, list=16%, signal=43%	
ACTIN FILAMENT CAPPING%GOBP%GO:0051693	ACTIN FILAMENT CAPPING%GOBP%GO:0051693		17	0.71669185	1.7831714	0.0038350911	0.08631112	0.996	868	tags=29%, list=5%, signal=31%	
OMEGA 3 FATTY ACIDS IN SENESCENCE%WIKIPATHWAYS_20250210%WP5432%HOMO SAPIENS	OMEGA 3 FATTY ACIDS IN SENESCENCE%WIKIPATHWAYS_20250210%WP5432%HOMO SAPIENS		16	0.742242	1.7815864	0.0010427529	0.087127484	0.996	1124	tags=38%, list=6%, signal=40%	
LEUKOCYTE CHEMOTAXIS%GOBP%GO:0030595	LEUKOCYTE CHEMOTAXIS%GOBP%GO:0030595		63	0.55542856	1.7815738	0.0	0.08598832	0.996	1995	tags=29%, list=11%, signal=32%	
INTERLEUKIN RECEPTOR SHC SIGNALING%REACTOME DATABASE ID RELEASE 91%912526	INTERLEUKIN RECEPTOR SHC SIGNALING%REACTOME DATABASE ID RELEASE 91%912526		18	0.70379275	1.7739699	0.0029732408	0.09338553	0.9985	1710	tags=33%, list=9%, signal=37%	
BARBED-END ACTIN FILAMENT CAPPING%GOBP%GO:0051016	BARBED-END ACTIN FILAMENT CAPPING%GOBP%GO:0051016		17	0.71669185	1.7724478	0.0047393367	0.0942701	0.9985	868	tags=29%, list=5%, signal=31%	
ANTIGEN PROCESSING AND PRESENTATION OF ENDOGENOUS ANTIGEN%GOBP%GO:0019883	ANTIGEN PROCESSING AND PRESENTATION OF ENDOGENOUS ANTIGEN%GOBP%GO:0019883		23	0.6765277	1.7721361	0.003805899	0.093527496	0.9985	1139	tags=35%, list=6%, signal=37%	
REPLACEMENT OF PROTAMINES BY NUCLEOSOMES IN THE MALE PRONUCLEUS%REACTOME%R-HSA-9821993.1	REPLACEMENT OF PROTAMINES BY NUCLEOSOMES IN THE MALE PRONUCLEUS%REACTOME%R-HSA-9821993.1		17	0.7208627	1.7699368	0.005055612	0.09518374	0.999	2772	tags=59%, list=15%, signal=69%	
OXIDATIVE STRESS INDUCED SENESCENCE%REACTOME DATABASE ID RELEASE 91%2559580	OXIDATIVE STRESS INDUCED SENESCENCE%REACTOME DATABASE ID RELEASE 91%2559580		85	0.5211791	1.7694044	0.0	0.09455746	0.999	2315	tags=27%, list=12%, signal=31%	
NUCLEOSOME ASSEMBLY%REACTOME DATABASE ID RELEASE 91%774815	NUCLEOSOME ASSEMBLY%REACTOME DATABASE ID RELEASE 91%774815		48	0.57471573	1.7693332	9.328358E-4	0.093491636	0.999	2315	tags=31%, list=12%, signal=36%	
LONG-CHAIN FATTY ACID METABOLIC PROCESS%GOBP%GO:0001676	LONG-CHAIN FATTY ACID METABOLIC PROCESS%GOBP%GO:0001676		78	0.53160775	1.7628257	0.0	0.10046281	0.9995	1150	tags=23%, list=6%, signal=24%	
DNA DAMAGE TELOMERE STRESS INDUCED SENESCENCE%REACTOME%R-HSA-2559586.5	DNA DAMAGE TELOMERE STRESS INDUCED SENESCENCE%REACTOME%R-HSA-2559586.5		53	0.5674471	1.7600836	9.0826524E-4	0.10288595	0.9995	2900	tags=36%, list=15%, signal=42%	
INTERLEUKIN-20 FAMILY SIGNALING%REACTOME%R-HSA-8854691.8	INTERLEUKIN-20 FAMILY SIGNALING%REACTOME%R-HSA-8854691.8		22	0.6709048	1.7594353	0.0069444445	0.10254024	0.9995	1296	tags=36%, list=7%, signal=39%	
SIGNALING EVENTS MEDIATED BY PTP1B%PATHWAY INTERACTION DATABASE NCI-NATURE CURATED DATA%SIGNALING EVENTS MEDIATED BY PTP1B	SIGNALING EVENTS MEDIATED BY PTP1B%PATHWAY INTERACTION DATABASE NCI-NATURE CURATED DATA%SIGNALING EVENTS MEDIATED BY PTP1B		47	0.57307047	1.759122	9.276438E-4	0.10174394	0.9995	3035	tags=30%, list=16%, signal=35%	
IMMUNOGLOBULIN MEDIATED IMMUNE RESPONSE%GOBP%GO:0016064	IMMUNOGLOBULIN MEDIATED IMMUNE RESPONSE%GOBP%GO:0016064		33	0.6097254	1.7588584	0.0	0.10085892	0.9995	3451	tags=39%, list=18%, signal=48%	
NEGATIVE REGULATION OF T CELL MEDIATED IMMUNITY%GOBP%GO:0002710	NEGATIVE REGULATION OF T CELL MEDIATED IMMUNITY%GOBP%GO:0002710		15	0.728603	1.758479	0.005005005	0.100162454	0.9995	1855	tags=40%, list=10%, signal=44%	
LYMPHOCYTE MEDIATED IMMUNITY%GOBP%GO:0002449	LYMPHOCYTE MEDIATED IMMUNITY%GOBP%GO:0002449		73	0.5390857	1.755993	0.0018066848	0.101923265	0.9995	3202	tags=36%, list=17%, signal=43%	
PEPTIDE METABOLIC PROCESS%GOBP%GO:0006518	PEPTIDE METABOLIC PROCESS%GOBP%GO:0006518		40	0.5883226	1.751119	0.0018365473	0.107006796	1.0	711	tags=18%, list=4%, signal=18%	
NEGATIVE REGULATION OF ACTIN FILAMENT DEPOLYMERIZATION%GOBP%GO:0030835	NEGATIVE REGULATION OF ACTIN FILAMENT DEPOLYMERIZATION%GOBP%GO:0030835		20	0.6828992	1.7474306	0.0028790787	0.111007325	1.0	868	tags=25%, list=5%, signal=26%	
DEPOSITION OF NEW CENPA-CONTAINING NUCLEOSOMES AT THE CENTROMERE%REACTOME DATABASE ID RELEASE 91%606279	DEPOSITION OF NEW CENPA-CONTAINING NUCLEOSOMES AT THE CENTROMERE%REACTOME DATABASE ID RELEASE 91%606279		48	0.57471573	1.7425679	0.0017777778	0.116250426	1.0	2315	tags=31%, list=12%, signal=36%	
EPIGENETIC REGULATION OF ADIPOGENESIS GENES BY MLL3 AND MLL4 COMPLEXES%REACTOME DATABASE ID RELEASE 91%9851695	EPIGENETIC REGULATION OF ADIPOGENESIS GENES BY MLL3 AND MLL4 COMPLEXES%REACTOME DATABASE ID RELEASE 91%9851695		92	0.50857455	1.7416757	0.0017079419	0.1162035	1.0	1735	tags=25%, list=9%, signal=27%	
HALLMARK_SPERMATOGENESIS%MSIGDBHALLMARK%HALLMARK_SPERMATOGENESIS	HALLMARK_SPERMATOGENESIS%MSIGDBHALLMARK%HALLMARK_SPERMATOGENESIS		70	0.5309665	1.7415359	0.0	0.11521169	1.0	2862	tags=27%, list=15%, signal=32%	
B-WICH COMPLEX POSITIVELY REGULATES RRNA EXPRESSION%REACTOME%R-HSA-5250924.4	B-WICH COMPLEX POSITIVELY REGULATES RRNA EXPRESSION%REACTOME%R-HSA-5250924.4		52	0.5623233	1.7401224	8.764242E-4	0.11584123	1.0	2315	tags=31%, list=12%, signal=35%	
APAP ADME%REACTOME%R-HSA-9753281.3	APAP ADME%REACTOME%R-HSA-9753281.3		20	0.6875982	1.7388865	0.00499002	0.116337456	1.0	573	tags=25%, list=3%, signal=26%	
MLL4 AND MLL3 COMPLEXES REGULATE EXPRESSION OF PPARG TARGET GENES IN ADIPOGENESIS AND HEPATIC STEATOSIS%REACTOME DATABASE ID RELEASE 91%9841922	MLL4 AND MLL3 COMPLEXES REGULATE EXPRESSION OF PPARG TARGET GENES IN ADIPOGENESIS AND HEPATIC STEATOSIS%REACTOME DATABASE ID RELEASE 91%9841922		92	0.50857455	1.7379053	8.952551E-4	0.116546534	1.0	1735	tags=25%, list=9%, signal=27%	
ANTIGEN PROCESSING AND PRESENTATION%GOBP%GO:0019882	ANTIGEN PROCESSING AND PRESENTATION%GOBP%GO:0019882		73	0.5271894	1.7373108	0.0	0.11613052	1.0	1139	tags=16%, list=6%, signal=17%	
MEIOTIC SYNAPSIS%REACTOME%R-HSA-1221632.3	MEIOTIC SYNAPSIS%REACTOME%R-HSA-1221632.3		48	0.56214726	1.7371395	0.0038647342	0.11517339	1.0	2315	tags=31%, list=12%, signal=36%	
REGULATION OF LYMPHOCYTE CHEMOTAXIS%GOBP%GO:1901623	REGULATION OF LYMPHOCYTE CHEMOTAXIS%GOBP%GO:1901623		15	0.7173773	1.7328718	0.004004004	0.12020154	1.0	2718	tags=47%, list=14%, signal=54%	
AMINE LIGAND-BINDING RECEPTORS%REACTOME DATABASE ID RELEASE 91%375280	AMINE LIGAND-BINDING RECEPTORS%REACTOME DATABASE ID RELEASE 91%375280		21	0.6665666	1.729604	0.007035176	0.12371867	1.0	1362	tags=33%, list=7%, signal=36%	
TRANSCRIPTIONAL REGULATION BY SMALL RNAS%REACTOME DATABASE ID RELEASE 91%5578749	TRANSCRIPTIONAL REGULATION BY SMALL RNAS%REACTOME DATABASE ID RELEASE 91%5578749		66	0.5341796	1.7286456	0.0	0.12396351	1.0	2315	tags=26%, list=12%, signal=29%	
LEUKOCYTE MEDIATED IMMUNITY%GOBP%GO:0002443	LEUKOCYTE MEDIATED IMMUNITY%GOBP%GO:0002443		90	0.5088882	1.7268276	9.0826524E-4	0.12540781	1.0	3202	tags=31%, list=17%, signal=37%	
UNSATURATED FATTY ACID BIOSYNTHETIC PROCESS%GOBP%GO:0006636	UNSATURATED FATTY ACID BIOSYNTHETIC PROCESS%GOBP%GO:0006636		26	0.642048	1.7220278	0.0056926	0.13177718	1.0	1522	tags=31%, list=8%, signal=33%	
POSITIVE REGULATION OF PHAGOCYTOSIS%GOBP%GO:0050766	POSITIVE REGULATION OF PHAGOCYTOSIS%GOBP%GO:0050766		49	0.55981493	1.7215458	0.003561888	0.13123213	1.0	3233	tags=39%, list=17%, signal=47%	
RNA POLYMERASE I PROMOTER ESCAPE%REACTOME DATABASE ID RELEASE 91%73772	RNA POLYMERASE I PROMOTER ESCAPE%REACTOME DATABASE ID RELEASE 91%73772		53	0.5572159	1.7214453	0.0045330916	0.13010792	1.0	2315	tags=30%, list=12%, signal=34%	
VALIDATED TRANSCRIPTIONAL TARGETS OF TAP63 ISOFORMS%PATHWAY INTERACTION DATABASE NCI-NATURE CURATED DATA%VALIDATED TRANSCRIPTIONAL TARGETS OF TAP63 ISOFORMS	VALIDATED TRANSCRIPTIONAL TARGETS OF TAP63 ISOFORMS%PATHWAY INTERACTION DATABASE NCI-NATURE CURATED DATA%VALIDATED TRANSCRIPTIONAL TARGETS OF TAP63 ISOFORMS		53	0.55431235	1.721055	9.2678407E-4	0.12962125	1.0	1936	tags=30%, list=10%, signal=34%	
RUNX1 REGULATES GENES INVOLVED IN MEGAKARYOCYTE DIFFERENTIATION AND PLATELET FUNCTION%REACTOME%R-HSA-8936459.2	RUNX1 REGULATES GENES INVOLVED IN MEGAKARYOCYTE DIFFERENTIATION AND PLATELET FUNCTION%REACTOME%R-HSA-8936459.2		57	0.54335654	1.7195177	0.0017825312	0.13064848	1.0	2772	tags=37%, list=15%, signal=43%	
EPIGENETIC REGULATION OF GENE EXPRESSION BY MLL3 AND MLL4 COMPLEXES%REACTOME DATABASE ID RELEASE 91%9818564	EPIGENETIC REGULATION OF GENE EXPRESSION BY MLL3 AND MLL4 COMPLEXES%REACTOME DATABASE ID RELEASE 91%9818564		92	0.50857455	1.7195034	0.0	0.1294798	1.0	1735	tags=25%, list=9%, signal=27%	
DRUG ADME%REACTOME%R-HSA-9748784.5	DRUG ADME%REACTOME%R-HSA-9748784.5		55	0.54630417	1.7180947	9.1827364E-4	0.13043372	1.0	1053	tags=22%, list=6%, signal=23%	
B CELL MEDIATED IMMUNITY%GOBP%GO:0019724	B CELL MEDIATED IMMUNITY%GOBP%GO:0019724		36	0.5909983	1.7180885	0.0037807184	0.12926854	1.0	3451	tags=39%, list=18%, signal=48%	
POSITIVE REGULATION OF B CELL PROLIFERATION%GOBP%GO:0030890	POSITIVE REGULATION OF B CELL PROLIFERATION%GOBP%GO:0030890		22	0.6582749	1.7174134	0.009596929	0.1291486	1.0	449	tags=23%, list=2%, signal=23%	
REGULATION OF COMPLEMENT CASCADE%REACTOME DATABASE ID RELEASE 91%977606	REGULATION OF COMPLEMENT CASCADE%REACTOME DATABASE ID RELEASE 91%977606		30	0.6213626	1.7168506	0.009285051	0.12878323	1.0	3451	tags=43%, list=18%, signal=53%	
GLYCEROLIPID CATABOLIC PROCESS%GOBP%GO:0046503	GLYCEROLIPID CATABOLIC PROCESS%GOBP%GO:0046503		36	0.5899666	1.713846	0.0037037036	0.13200653	1.0	2106	tags=31%, list=11%, signal=34%	
