NAME	GS<br> follow link to MSigDB	GS DETAILS	SIZE	ES	NES	NOM p-val	FDR q-val	FWER p-val	RANK AT MAX	LEADING EDGE	
TRANSCRIPTIONAL REGULATION OF WHITE ADIPOCYTE DIFFERENTIATION%REACTOME%R-HSA-381340.5	TRANSCRIPTIONAL REGULATION OF WHITE ADIPOCYTE DIFFERENTIATION%REACTOME%R-HSA-381340.5		76	0.3291098	1.0879927	0.2987013	0.6497301	1.0	2034	tags=14%, list=11%, signal=16%	
MEMBRANE INVAGINATION%GOBP%GO:0010324	MEMBRANE INVAGINATION%GOBP%GO:0010324		35	0.3798729	1.0876818	0.3217636	0.650177	1.0	1336	tags=11%, list=7%, signal=12%	
SYNAPSE ORGANIZATION%GOBP%GO:0050808	SYNAPSE ORGANIZATION%GOBP%GO:0050808		171	0.29364172	1.0876487	0.276509	0.64988625	1.0	2178	tags=18%, list=12%, signal=20%	
REGULATION OF MITF-M-DEPENDENT GENES INVOLVED IN CELL CYCLE AND PROLIFERATION%REACTOME DATABASE ID RELEASE 91%9825892	REGULATION OF MITF-M-DEPENDENT GENES INVOLVED IN CELL CYCLE AND PROLIFERATION%REACTOME DATABASE ID RELEASE 91%9825892		17	0.44564292	1.0875576	0.3620352	0.6497333	1.0	3091	tags=35%, list=16%, signal=42%	
POSITIVE REGULATION OF BLOOD VESSEL ENDOTHELIAL CELL MIGRATION%GOBP%GO:0043536	POSITIVE REGULATION OF BLOOD VESSEL ENDOTHELIAL CELL MIGRATION%GOBP%GO:0043536		46	0.35992417	1.087265	0.33636364	0.6501438	1.0	1791	tags=17%, list=9%, signal=19%	
POSTSYNAPTIC SIGNAL TRANSDUCTION%GOBP%GO:0098926	POSTSYNAPTIC SIGNAL TRANSDUCTION%GOBP%GO:0098926		30	0.39340398	1.0871977	0.33557048	0.6499572	1.0	1625	tags=13%, list=9%, signal=15%	
NEGATIVE REGULATION OF PROTEIN BINDING%GOBP%GO:0032091	NEGATIVE REGULATION OF PROTEIN BINDING%GOBP%GO:0032091		47	0.35978112	1.0870544	0.32484075	0.64994967	1.0	2424	tags=21%, list=13%, signal=24%	
REGULATION OF LIPOPOLYSACCHARIDE-MEDIATED SIGNALING PATHWAY%GOBP%GO:0031664	REGULATION OF LIPOPOLYSACCHARIDE-MEDIATED SIGNALING PATHWAY%GOBP%GO:0031664		17	0.4427472	1.0863972	0.3488372	0.65129346	1.0	986	tags=18%, list=5%, signal=19%	
PID_FOXM1_PATHWAY%MSIGDB_C2%PID_FOXM1_PATHWAY	PID_FOXM1_PATHWAY%MSIGDB_C2%PID_FOXM1_PATHWAY		35	0.37562063	1.0862995	0.32118887	0.65117127	1.0	5036	tags=37%, list=27%, signal=51%	
REGULATION OF MUSCLE CELL APOPTOTIC PROCESS%GOBP%GO:0010660	REGULATION OF MUSCLE CELL APOPTOTIC PROCESS%GOBP%GO:0010660		29	0.39222464	1.0857096	0.33805478	0.6523647	1.0	206	tags=10%, list=1%, signal=10%	
HEMATOPOIETIC STEM CELL GENE REGULATION BY GABP ALPHA BETA COMPLEX%WIKIPATHWAYS_20250210%WP3657%HOMO SAPIENS	HEMATOPOIETIC STEM CELL GENE REGULATION BY GABP ALPHA BETA COMPLEX%WIKIPATHWAYS_20250210%WP3657%HOMO SAPIENS		15	0.46104318	1.0852876	0.3529412	0.65312517	1.0	119	tags=7%, list=1%, signal=7%	
B CELL ACTIVATION%PANTHER PATHWAY%P00010	B CELL ACTIVATION%PANTHER PATHWAY%P00010		53	0.3525154	1.0852649	0.32079023	0.6528081	1.0	2505	tags=25%, list=13%, signal=28%	
REGULATION OF PROTEIN SERINE/THREONINE KINASE ACTIVITY%GOBP%GO:0071900	REGULATION OF PROTEIN SERINE/THREONINE KINASE ACTIVITY%GOBP%GO:0071900		159	0.2962858	1.0845456	0.27931595	0.65435964	1.0	3149	tags=23%, list=17%, signal=28%	
CARDIAC CHAMBER MORPHOGENESIS%GOBP%GO:0003206	CARDIAC CHAMBER MORPHOGENESIS%GOBP%GO:0003206		70	0.33027837	1.0844921	0.31663686	0.6541181	1.0	2143	tags=23%, list=11%, signal=26%	
FC RECEPTOR SIGNALING PATHWAY%GOBP%GO:0038093	FC RECEPTOR SIGNALING PATHWAY%GOBP%GO:0038093		40	0.37094602	1.0842133	0.33620688	0.65449584	1.0	807	tags=13%, list=4%, signal=13%	
TGF_BETA_RECEPTOR%NETPATH%TGF_BETA_RECEPTOR	TGF_BETA_RECEPTOR%NETPATH%TGF_BETA_RECEPTOR		105	0.31048563	1.0842096	0.29051217	0.654132	1.0	1978	tags=11%, list=10%, signal=13%	
LEPTIN%NETPATH%LEPTIN	LEPTIN%NETPATH%LEPTIN		40	0.37291366	1.0841318	0.32387924	0.6539672	1.0	1239	tags=15%, list=7%, signal=16%	
THE ONCOGENIC ACTION OF SUCCINATE%PATHWHIZ%PW002360	THE ONCOGENIC ACTION OF SUCCINATE%PATHWHIZ%PW002360		27	0.39557678	1.0832546	0.33739457	0.65589666	1.0	2370	tags=26%, list=13%, signal=30%	
POSITIVE REGULATION OF REGULATORY T CELL DIFFERENTIATION%GOBP%GO:0045591	POSITIVE REGULATION OF REGULATORY T CELL DIFFERENTIATION%GOBP%GO:0045591		16	0.44823745	1.0831789	0.37853658	0.65570873	1.0	1855	tags=31%, list=10%, signal=35%	
BIOCARTA_CERAMIDE_PATHWAY%MSIGDB_C2%BIOCARTA_CERAMIDE_PATHWAY	BIOCARTA_CERAMIDE_PATHWAY%MSIGDB_C2%BIOCARTA_CERAMIDE_PATHWAY		21	0.42232153	1.0830235	0.35728544	0.65574855	1.0	1998	tags=24%, list=11%, signal=27%	
REGULATION OF KIDNEY DEVELOPMENT%GOBP%GO:0090183	REGULATION OF KIDNEY DEVELOPMENT%GOBP%GO:0090183		21	0.4217185	1.0829546	0.34901962	0.65556175	1.0	1502	tags=19%, list=8%, signal=21%	
MEMBRANE DEPOLARIZATION%GOBP%GO:0051899	MEMBRANE DEPOLARIZATION%GOBP%GO:0051899		32	0.3796739	1.0829328	0.35166818	0.6552479	1.0	4267	tags=44%, list=23%, signal=56%	
REGULATION OF PHOSPHOLIPID METABOLIC PROCESS%GOBP%GO:1903725	REGULATION OF PHOSPHOLIPID METABOLIC PROCESS%GOBP%GO:1903725		21	0.41333982	1.0828543	0.3510848	0.65507156	1.0	3306	tags=33%, list=18%, signal=40%	
REGULATION OF BETA-CELL DEVELOPMENT%REACTOME DATABASE ID RELEASE 91%186712	REGULATION OF BETA-CELL DEVELOPMENT%REACTOME DATABASE ID RELEASE 91%186712		26	0.40236765	1.0825635	0.3313783	0.65544516	1.0	2851	tags=27%, list=15%, signal=32%	
INTERMEDIATE FILAMENT-BASED PROCESS%GOBP%GO:0045103	INTERMEDIATE FILAMENT-BASED PROCESS%GOBP%GO:0045103		52	0.3501019	1.0822729	0.33120438	0.65586936	1.0	1930	tags=23%, list=10%, signal=26%	
EMBRYONIC EPITHELIAL TUBE FORMATION%GOBP%GO:0001838	EMBRYONIC EPITHELIAL TUBE FORMATION%GOBP%GO:0001838		36	0.37476304	1.0819541	0.34253094	0.6563161	1.0	2409	tags=25%, list=13%, signal=29%	
CARDIAC MUSCLE CELL CONTRACTION%GOBP%GO:0086003	CARDIAC MUSCLE CELL CONTRACTION%GOBP%GO:0086003		33	0.38045096	1.0819178	0.32669324	0.6560308	1.0	1650	tags=15%, list=9%, signal=17%	
RESPONSE TO LIGHT STIMULUS%GOBP%GO:0009416	RESPONSE TO LIGHT STIMULUS%GOBP%GO:0009416		177	0.28896287	1.0817631	0.28372854	0.65604526	1.0	3036	tags=19%, list=16%, signal=23%	
RHOA GTPASE CYCLE%REACTOME DATABASE ID RELEASE 91%8980692	RHOA GTPASE CYCLE%REACTOME DATABASE ID RELEASE 91%8980692		144	0.29763046	1.0816956	0.2760684	0.655858	1.0	2660	tags=22%, list=14%, signal=25%	
BIOCARTA_FCER1_PATHWAY%MSIGDB_C2%BIOCARTA_FCER1_PATHWAY	BIOCARTA_FCER1_PATHWAY%MSIGDB_C2%BIOCARTA_FCER1_PATHWAY		27	0.39694405	1.080969	0.33986288	0.6573788	1.0	4969	tags=56%, list=26%, signal=75%	
NRP1 TRIGGERED SIGNALING IN PANCREATIC CANCER %WIKIPATHWAYS_20250210%WP5144%HOMO SAPIENS	NRP1 TRIGGERED SIGNALING IN PANCREATIC CANCER %WIKIPATHWAYS_20250210%WP5144%HOMO SAPIENS		39	0.36498803	1.0808688	0.33271375	0.65729547	1.0	3207	tags=26%, list=17%, signal=31%	
REGULATION OF SMOOTH MUSCLE CELL APOPTOTIC PROCESS%GOBP%GO:0034391	REGULATION OF SMOOTH MUSCLE CELL APOPTOTIC PROCESS%GOBP%GO:0034391		18	0.4340304	1.0803775	0.36035156	0.65821797	1.0	206	tags=11%, list=1%, signal=11%	
KLEEFSTRA SYNDROME%WIKIPATHWAYS_20250210%WP5351%HOMO SAPIENS	KLEEFSTRA SYNDROME%WIKIPATHWAYS_20250210%WP5351%HOMO SAPIENS		19	0.42616144	1.0801142	0.35867447	0.6585535	1.0	2401	tags=16%, list=13%, signal=18%	
THE ONCOGENIC ACTION OF FUMARATE%PATHWHIZ%PW002363	THE ONCOGENIC ACTION OF FUMARATE%PATHWHIZ%PW002363		27	0.39557678	1.0798664	0.34881517	0.6588259	1.0	2370	tags=26%, list=13%, signal=30%	
CELLULAR ROLES OF ANTHRAX TOXIN%PATHWAY INTERACTION DATABASE NCI-NATURE CURATED DATA%CELLULAR ROLES OF ANTHRAX TOXIN	CELLULAR ROLES OF ANTHRAX TOXIN%PATHWAY INTERACTION DATABASE NCI-NATURE CURATED DATA%CELLULAR ROLES OF ANTHRAX TOXIN		16	0.4465189	1.079442	0.3557505	0.65959245	1.0	1695	tags=19%, list=9%, signal=21%	
REGULATION OF MITOCHONDRION ORGANIZATION%GOBP%GO:0010821	REGULATION OF MITOCHONDRION ORGANIZATION%GOBP%GO:0010821		101	0.31169248	1.0793169	0.3142361	0.6595601	1.0	1480	tags=13%, list=8%, signal=14%	
OOGENESIS%GOBP%GO:0048477	OOGENESIS%GOBP%GO:0048477		31	0.3818001	1.0792121	0.35092592	0.65946937	1.0	1750	tags=16%, list=9%, signal=18%	
LUNG DEVELOPMENT%GOBP%GO:0030324	LUNG DEVELOPMENT%GOBP%GO:0030324		39	0.36959207	1.0791123	0.32884097	0.6593423	1.0	2143	tags=28%, list=11%, signal=32%	
POSITIVE REGULATION OF MORPHOGENESIS OF AN EPITHELIUM%GOBP%GO:1905332	POSITIVE REGULATION OF MORPHOGENESIS OF AN EPITHELIUM%GOBP%GO:1905332		22	0.40763798	1.0790629	0.3549323	0.65910566	1.0	1419	tags=18%, list=8%, signal=20%	
ENDOMETRIAL CANCER%WIKIPATHWAYS_20250210%WP4155%HOMO SAPIENS	ENDOMETRIAL CANCER%WIKIPATHWAYS_20250210%WP4155%HOMO SAPIENS		42	0.36038497	1.0786723	0.33738318	0.65974516	1.0	3458	tags=26%, list=18%, signal=32%	
AEROBIC RESPIRATION%GOBP%GO:0009060	AEROBIC RESPIRATION%GOBP%GO:0009060		128	0.30291653	1.0784502	0.30044445	0.6599623	1.0	6018	tags=40%, list=32%, signal=58%	
ESTROGEN METABOLIC PROCESS%GOBP%GO:0008210	ESTROGEN METABOLIC PROCESS%GOBP%GO:0008210		19	0.4276729	1.0782814	0.348659	0.6600449	1.0	3677	tags=53%, list=19%, signal=65%	
RHO GTPASES ACTIVATE ROCKS%REACTOME%R-HSA-5627117.5	RHO GTPASES ACTIVATE ROCKS%REACTOME%R-HSA-5627117.5		19	0.4273022	1.0781794	0.35951662	0.65994996	1.0	1580	tags=32%, list=8%, signal=34%	
KINESINS%REACTOME DATABASE ID RELEASE 91%983189	KINESINS%REACTOME DATABASE ID RELEASE 91%983189		40	0.36691496	1.0775036	0.3359299	0.6613346	1.0	3539	tags=45%, list=19%, signal=55%	
GLIAL CELL DIFFERENTIATION%GOBP%GO:0010001	GLIAL CELL DIFFERENTIATION%GOBP%GO:0010001		72	0.32509014	1.0774194	0.33044982	0.6611882	1.0	2108	tags=19%, list=11%, signal=22%	
MACROPHAGE DIFFERENTIATION%GOBP%GO:0030225	MACROPHAGE DIFFERENTIATION%GOBP%GO:0030225		22	0.41183314	1.0773652	0.3647388	0.6609651	1.0	1998	tags=27%, list=11%, signal=30%	
ALPHA6BETA4INTEGRIN%IOB%ALPHA6BETA4INTEGRIN	ALPHA6BETA4INTEGRIN%IOB%ALPHA6BETA4INTEGRIN		46	0.35683647	1.0765731	0.33602875	0.6626637	1.0	2242	tags=30%, list=12%, signal=34%	
REGULATION OF MITOTIC SISTER CHROMATID SEGREGATION%GOBP%GO:0033047	REGULATION OF MITOTIC SISTER CHROMATID SEGREGATION%GOBP%GO:0033047		52	0.35216963	1.0765275	0.32717678	0.6624064	1.0	3819	tags=29%, list=20%, signal=36%	
REGULATION OF ADENYLATE CYCLASE ACTIVITY%GOBP%GO:0045761	REGULATION OF ADENYLATE CYCLASE ACTIVITY%GOBP%GO:0045761		23	0.40680137	1.0764058	0.34808853	0.66235614	1.0	1388	tags=13%, list=7%, signal=14%	
BILE ACID BIOSYNTHETIC PROCESS%GOBP%GO:0006699	BILE ACID BIOSYNTHETIC PROCESS%GOBP%GO:0006699		19	0.42263302	1.0763615	0.3577075	0.6621004	1.0	1847	tags=16%, list=10%, signal=17%	
CELLULAR RESPONSE TO LIPOPOLYSACCHARIDE%GOBP%GO:0071222	CELLULAR RESPONSE TO LIPOPOLYSACCHARIDE%GOBP%GO:0071222		83	0.3230019	1.0761101	0.3330381	0.6623799	1.0	2927	tags=19%, list=16%, signal=23%	
TRAF6 MEDIATED IRF7 ACTIVATION%REACTOME%R-HSA-933541.7	TRAF6 MEDIATED IRF7 ACTIVATION%REACTOME%R-HSA-933541.7		17	0.4333971	1.0752959	0.3705104	0.6641299	1.0	1717	tags=18%, list=9%, signal=19%	
PID_EPHB_FWD_PATHWAY%MSIGDB_C2%PID_EPHB_FWD_PATHWAY	PID_EPHB_FWD_PATHWAY%MSIGDB_C2%PID_EPHB_FWD_PATHWAY		33	0.3781012	1.0750954	0.3479961	0.6642718	1.0	3314	tags=36%, list=18%, signal=44%	
PID_ER_NONGENOMIC_PATHWAY%MSIGDB_C2%PID_ER_NONGENOMIC_PATHWAY	PID_ER_NONGENOMIC_PATHWAY%MSIGDB_C2%PID_ER_NONGENOMIC_PATHWAY		29	0.38959274	1.0749732	0.3489933	0.66421044	1.0	4000	tags=41%, list=21%, signal=52%	
CLEAR CELL RENAL CELL CARCINOMA PATHWAYS%WIKIPATHWAYS_20250210%WP4018%HOMO SAPIENS	CLEAR CELL RENAL CELL CARCINOMA PATHWAYS%WIKIPATHWAYS_20250210%WP4018%HOMO SAPIENS		49	0.35076547	1.0743687	0.32911393	0.66540307	1.0	1084	tags=10%, list=6%, signal=11%	
REGULATION OF SODIUM ION TRANSMEMBRANE TRANSPORTER ACTIVITY%GOBP%GO:2000649	REGULATION OF SODIUM ION TRANSMEMBRANE TRANSPORTER ACTIVITY%GOBP%GO:2000649		23	0.41660732	1.0743313	0.37076476	0.66513836	1.0	1984	tags=30%, list=11%, signal=34%	
ISOPRENOID METABOLIC PROCESS%GOBP%GO:0006720	ISOPRENOID METABOLIC PROCESS%GOBP%GO:0006720		69	0.3280915	1.0740374	0.31753132	0.6655158	1.0	1915	tags=16%, list=10%, signal=18%	
CELLULAR RESPONSE TO METAL ION%GOBP%GO:0071248	CELLULAR RESPONSE TO METAL ION%GOBP%GO:0071248		88	0.31359988	1.0738643	0.3080851	0.6655979	1.0	1842	tags=17%, list=10%, signal=19%	
CELL-MATRIX ADHESION%GOBP%GO:0007160	CELL-MATRIX ADHESION%GOBP%GO:0007160		90	0.31518844	1.073834	0.3169447	0.6653047	1.0	2242	tags=22%, list=12%, signal=25%	
REGULATION OF INTERLEUKIN-12 PRODUCTION%GOBP%GO:0032655	REGULATION OF INTERLEUKIN-12 PRODUCTION%GOBP%GO:0032655		35	0.37237594	1.0730132	0.34283	0.6670571	1.0	2324	tags=20%, list=12%, signal=23%	
PI3K AKT SIGNALING IN CANCER%REACTOME DATABASE ID RELEASE 91%2219528	PI3K AKT SIGNALING IN CANCER%REACTOME DATABASE ID RELEASE 91%2219528		84	0.3211338	1.0723526	0.31782946	0.66840106	1.0	1791	tags=17%, list=9%, signal=18%	
NEGATIVE REGULATION OF TRANSFERASE ACTIVITY%GOBP%GO:0051348	NEGATIVE REGULATION OF TRANSFERASE ACTIVITY%GOBP%GO:0051348		127	0.30053073	1.0723509	0.30515638	0.66803294	1.0	2000	tags=15%, list=11%, signal=17%	
CALCIUM ION TRANSPORT%GOBP%GO:0006816	CALCIUM ION TRANSPORT%GOBP%GO:0006816		151	0.29586136	1.0722448	0.29320228	0.6679434	1.0	2593	tags=19%, list=14%, signal=21%	
REGULATION OF POTASSIUM ION TRANSPORT%GOBP%GO:0043266	REGULATION OF POTASSIUM ION TRANSPORT%GOBP%GO:0043266		52	0.34876126	1.0722331	0.3387978	0.667598	1.0	1739	tags=19%, list=9%, signal=21%	
SIGNALING EVENTS MEDIATED BY HDAC CLASS II%PATHWAY INTERACTION DATABASE NCI-NATURE CURATED DATA%SIGNALING EVENTS MEDIATED BY HDAC CLASS II	SIGNALING EVENTS MEDIATED BY HDAC CLASS II%PATHWAY INTERACTION DATABASE NCI-NATURE CURATED DATA%SIGNALING EVENTS MEDIATED BY HDAC CLASS II		34	0.37960395	1.0721883	0.34976304	0.6673485	1.0	1979	tags=18%, list=10%, signal=20%	
HALLMARK_KRAS_SIGNALING_DN%MSIGDBHALLMARK%HALLMARK_KRAS_SIGNALING_DN	HALLMARK_KRAS_SIGNALING_DN%MSIGDBHALLMARK%HALLMARK_KRAS_SIGNALING_DN		108	0.307696	1.0719706	0.32933104	0.6675412	1.0	2243	tags=20%, list=12%, signal=23%	
NEGATIVE REGULATION OF FATTY ACID BIOSYNTHETIC PROCESS%GOBP%GO:0045717	NEGATIVE REGULATION OF FATTY ACID BIOSYNTHETIC PROCESS%GOBP%GO:0045717		15	0.44657516	1.0718468	0.39130434	0.66750056	1.0	2699	tags=27%, list=14%, signal=31%	
INTERLEUKIN-12 SIGNALING%REACTOME%R-HSA-9020591.3	INTERLEUKIN-12 SIGNALING%REACTOME%R-HSA-9020591.3		38	0.3645127	1.0717655	0.33642262	0.66735005	1.0	2155	tags=13%, list=11%, signal=15%	
POSITIVE REGULATION OF EPITHELIAL CELL MIGRATION%GOBP%GO:0010634	POSITIVE REGULATION OF EPITHELIAL CELL MIGRATION%GOBP%GO:0010634		35	0.36637127	1.0713507	0.3504117	0.66806036	1.0	1259	tags=14%, list=7%, signal=15%	
REGULATION OF INTRACELLULAR PH%GOBP%GO:0051453	REGULATION OF INTRACELLULAR PH%GOBP%GO:0051453		67	0.3308479	1.0712299	0.34115523	0.6680047	1.0	2880	tags=25%, list=15%, signal=30%	
CARTILAGE DEVELOPMENT%GOBP%GO:0051216	CARTILAGE DEVELOPMENT%GOBP%GO:0051216		52	0.3466908	1.0712209	0.3391867	0.66765904	1.0	2056	tags=23%, list=11%, signal=26%	
SPHINGOLIPID METABOLISM OVERVIEW%WIKIPATHWAYS_20250210%WP4725%HOMO SAPIENS	SPHINGOLIPID METABOLISM OVERVIEW%WIKIPATHWAYS_20250210%WP4725%HOMO SAPIENS		22	0.40963247	1.0711284	0.36056337	0.66752875	1.0	1817	tags=23%, list=10%, signal=25%	
SIGNALING BY CSF3 (G-CSF)%REACTOME%R-HSA-9674555.4	SIGNALING BY CSF3 (G-CSF)%REACTOME%R-HSA-9674555.4		27	0.38432068	1.0710087	0.36142322	0.66747254	1.0	4232	tags=30%, list=22%, signal=38%	
SENSORY PERCEPTION OF SOUND%GOBP%GO:0007605	SENSORY PERCEPTION OF SOUND%GOBP%GO:0007605		74	0.32758933	1.0707071	0.3233276	0.66794264	1.0	3388	tags=28%, list=18%, signal=34%	
REGULATION OF GLYCOPROTEIN BIOSYNTHETIC PROCESS%GOBP%GO:0010559	REGULATION OF GLYCOPROTEIN BIOSYNTHETIC PROCESS%GOBP%GO:0010559		27	0.39325866	1.0706425	0.35897437	0.66774	1.0	1970	tags=22%, list=10%, signal=25%	
CELLULAR RESPONSE TO BIOTIC STIMULUS%GOBP%GO:0071216	CELLULAR RESPONSE TO BIOTIC STIMULUS%GOBP%GO:0071216		110	0.30378526	1.0705274	0.3256607	0.6676698	1.0	2927	tags=19%, list=16%, signal=22%	
ORGANIC CATION TRANSPORT%GOBP%GO:0015695	ORGANIC CATION TRANSPORT%GOBP%GO:0015695		59	0.33624494	1.070369	0.34570137	0.6677128	1.0	1100	tags=14%, list=6%, signal=14%	
RESPONSE TO FATTY ACID%GOBP%GO:0070542	RESPONSE TO FATTY ACID%GOBP%GO:0070542		19	0.42756745	1.0702561	0.38018867	0.6676346	1.0	1452	tags=21%, list=8%, signal=23%	
NUCLEOSIDE PHOSPHATE CATABOLIC PROCESS%GOBP%GO:1901292	NUCLEOSIDE PHOSPHATE CATABOLIC PROCESS%GOBP%GO:1901292		89	0.31778076	1.0701088	0.33571428	0.66765916	1.0	3115	tags=21%, list=17%, signal=25%	
REGULATION OF T CELL DIFFERENTIATION%GOBP%GO:0045580	REGULATION OF T CELL DIFFERENTIATION%GOBP%GO:0045580		105	0.30668867	1.0698612	0.33109808	0.66797733	1.0	1855	tags=16%, list=10%, signal=18%	
POSITIVE REGULATION OF PROTEIN TARGETING TO MEMBRANE%GOBP%GO:0090314	POSITIVE REGULATION OF PROTEIN TARGETING TO MEMBRANE%GOBP%GO:0090314		20	0.42121872	1.0698143	0.37323943	0.6677322	1.0	2000	tags=25%, list=11%, signal=28%	
PRE-NOTCH PROCESSING IN GOLGI%REACTOME DATABASE ID RELEASE 91%1912420	PRE-NOTCH PROCESSING IN GOLGI%REACTOME DATABASE ID RELEASE 91%1912420		18	0.43684366	1.0695789	0.37814313	0.667994	1.0	2851	tags=33%, list=15%, signal=39%	
PROTEIN FOLDING%REACTOME DATABASE ID RELEASE 91%391251	PROTEIN FOLDING%REACTOME DATABASE ID RELEASE 91%391251		89	0.31466025	1.069423	0.32269505	0.6680454	1.0	1214	tags=9%, list=6%, signal=10%	
POSITIVE REGULATION OF TRIGLYCERIDE METABOLIC PROCESS%GOBP%GO:0090208	POSITIVE REGULATION OF TRIGLYCERIDE METABOLIC PROCESS%GOBP%GO:0090208		16	0.44276702	1.0690907	0.3881323	0.66852874	1.0	2371	tags=25%, list=13%, signal=29%	
DOWNSTREAM SIGNALING IN NAIVE CD8+ T CELLS%PATHWAY INTERACTION DATABASE NCI-NATURE CURATED DATA%DOWNSTREAM SIGNALING IN NAIVE CD8+ T CELLS	DOWNSTREAM SIGNALING IN NAIVE CD8+ T CELLS%PATHWAY INTERACTION DATABASE NCI-NATURE CURATED DATA%DOWNSTREAM SIGNALING IN NAIVE CD8+ T CELLS		38	0.3625024	1.0689616	0.35673076	0.66851985	1.0	4299	tags=34%, list=23%, signal=44%	
CELL-CELL ADHESION MEDIATED BY CADHERIN%GOBP%GO:0044331	CELL-CELL ADHESION MEDIATED BY CADHERIN%GOBP%GO:0044331		21	0.4155508	1.0686328	0.36567163	0.66902596	1.0	2522	tags=33%, list=13%, signal=38%	
AXON GUIDANCE MEDIATED BY SLIT ROBO%PANTHER PATHWAY%P00008	AXON GUIDANCE MEDIATED BY SLIT ROBO%PANTHER PATHWAY%P00008		18	0.43286207	1.0685748	0.36723164	0.66881555	1.0	642	tags=22%, list=3%, signal=23%	
MITOTIC G1 PHASE AND G1 S TRANSITION%REACTOME%R-HSA-453279.6	MITOTIC G1 PHASE AND G1 S TRANSITION%REACTOME%R-HSA-453279.6		138	0.29625857	1.0685089	0.3123467	0.6686229	1.0	4199	tags=22%, list=22%, signal=28%	
PIWI-INTERACTING RNA (PIRNA) BIOGENESIS%REACTOME%R-HSA-5601884.3	PIWI-INTERACTING RNA (PIRNA) BIOGENESIS%REACTOME%R-HSA-5601884.3		22	0.4110604	1.0684521	0.36346516	0.6684017	1.0	2058	tags=18%, list=11%, signal=20%	
REGULATION OF ACTIN FILAMENT POLYMERIZATION%GOBP%GO:0030833	REGULATION OF ACTIN FILAMENT POLYMERIZATION%GOBP%GO:0030833		79	0.3229003	1.068449	0.3268379	0.6680422	1.0	2896	tags=22%, list=15%, signal=25%	
REGULATION OF GTPASE ACTIVITY%GOBP%GO:0043087	REGULATION OF GTPASE ACTIVITY%GOBP%GO:0043087		147	0.29444003	1.068159	0.32109374	0.66843987	1.0	2737	tags=20%, list=15%, signal=23%	
PARKINSON DISEASE%PANTHER PATHWAY%P00049	PARKINSON DISEASE%PANTHER PATHWAY%P00049		44	0.35430765	1.0675535	0.35852534	0.66966206	1.0	2427	tags=23%, list=13%, signal=26%	
HALLMARK_HEDGEHOG_SIGNALING%MSIGDBHALLMARK%HALLMARK_HEDGEHOG_SIGNALING	HALLMARK_HEDGEHOG_SIGNALING%MSIGDBHALLMARK%HALLMARK_HEDGEHOG_SIGNALING		25	0.3974491	1.0674593	0.35148042	0.669549	1.0	1854	tags=28%, list=10%, signal=31%	
OXIDATIVE STRESS RESPONSE%PANTHER PATHWAY%P00046	OXIDATIVE STRESS RESPONSE%PANTHER PATHWAY%P00046		21	0.41351107	1.0672315	0.37156397	0.66975933	1.0	1905	tags=19%, list=10%, signal=21%	
REGULATION OF PROTEIN TARGETING TO MEMBRANE%GOBP%GO:0090313	REGULATION OF PROTEIN TARGETING TO MEMBRANE%GOBP%GO:0090313		23	0.40044802	1.0671496	0.3624031	0.66960186	1.0	2000	tags=22%, list=11%, signal=24%	
CELLULAR RESPONSE TO MOLECULE OF BACTERIAL ORIGIN%GOBP%GO:0071219	CELLULAR RESPONSE TO MOLECULE OF BACTERIAL ORIGIN%GOBP%GO:0071219		90	0.3132664	1.0670415	0.31951642	0.6695392	1.0	2927	tags=19%, list=16%, signal=22%	
GASTRIN_CCK2R_240212%PANTHER PATHWAY%P06959	GASTRIN_CCK2R_240212%PANTHER PATHWAY%P06959		125	0.29771212	1.0668657	0.31630972	0.66961914	1.0	2862	tags=18%, list=15%, signal=21%	
SIGNALING BY CYTOSOLIC FGFR1 FUSION MUTANTS%REACTOME DATABASE ID RELEASE 91%1839117	SIGNALING BY CYTOSOLIC FGFR1 FUSION MUTANTS%REACTOME DATABASE ID RELEASE 91%1839117		16	0.43988508	1.0668602	0.37396693	0.66926736	1.0	4232	tags=38%, list=22%, signal=48%	
CARDIAC MUSCLE CONTRACTION%GOBP%GO:0060048	CARDIAC MUSCLE CONTRACTION%GOBP%GO:0060048		46	0.3533964	1.0666797	0.35543278	0.6693837	1.0	4323	tags=33%, list=23%, signal=42%	
FATTY ACID OXIDATION%GOBP%GO:0019395	FATTY ACID OXIDATION%GOBP%GO:0019395		60	0.33393136	1.0665896	0.35535714	0.6692553	1.0	1549	tags=15%, list=8%, signal=16%	
FAS LIGAND PATHWAY AND STRESS INDUCTION OF HEAT SHOCK PROTEINS%WIKIPATHWAYS_20250210%WP314%HOMO SAPIENS	FAS LIGAND PATHWAY AND STRESS INDUCTION OF HEAT SHOCK PROTEINS%WIKIPATHWAYS_20250210%WP314%HOMO SAPIENS		30	0.38651642	1.0663378	0.37229028	0.6695489	1.0	2241	tags=23%, list=12%, signal=26%	
CHROMOSOMAL AND MICROSATELLITE INSTABILITY IN COLORECTAL CANCER %WIKIPATHWAYS_20250210%WP4216%HOMO SAPIENS	CHROMOSOMAL AND MICROSATELLITE INSTABILITY IN COLORECTAL CANCER %WIKIPATHWAYS_20250210%WP4216%HOMO SAPIENS		53	0.34084007	1.0658917	0.3393502	0.67035353	1.0	1154	tags=13%, list=6%, signal=14%	
SUPERPATHWAY OF GLYCOSPHINGOLIPIDS BIOSYNTHESIS%BIOCYC%PWY-7835	SUPERPATHWAY OF GLYCOSPHINGOLIPIDS BIOSYNTHESIS%BIOCYC%PWY-7835		26	0.39148512	1.0658835	0.36663434	0.6700089	1.0	159	tags=12%, list=1%, signal=12%	
HOST-MEDIATED PERTURBATION OF SYMBIONT PROCESS%GOBP%GO:0051851	HOST-MEDIATED PERTURBATION OF SYMBIONT PROCESS%GOBP%GO:0051851		84	0.3159432	1.0656601	0.3292683	0.67021376	1.0	1109	tags=7%, list=6%, signal=8%	
NEGATIVE REGULATION OF LYMPHOCYTE DIFFERENTIATION%GOBP%GO:0045620	NEGATIVE REGULATION OF LYMPHOCYTE DIFFERENTIATION%GOBP%GO:0045620		32	0.37654614	1.0656197	0.35353535	0.6699569	1.0	268	tags=13%, list=1%, signal=13%	
NEGATIVE REGULATION OF SMALL MOLECULE METABOLIC PROCESS%GOBP%GO:0062014	NEGATIVE REGULATION OF SMALL MOLECULE METABOLIC PROCESS%GOBP%GO:0062014		72	0.32301888	1.0654566	0.32972974	0.6700283	1.0	2062	tags=19%, list=11%, signal=22%	
POSITIVE REGULATION OF SODIUM ION TRANSPORT%GOBP%GO:0010765	POSITIVE REGULATION OF SODIUM ION TRANSPORT%GOBP%GO:0010765		23	0.40190554	1.06462	0.36445785	0.6718057	1.0	2046	tags=22%, list=11%, signal=24%	
SPHINGOLIPID METABOLISM%REACTOME DATABASE ID RELEASE 91%428157	SPHINGOLIPID METABOLISM%REACTOME DATABASE ID RELEASE 91%428157		96	0.31059086	1.0646095	0.33420593	0.67147243	1.0	2380	tags=21%, list=13%, signal=24%	
POSITIVE REGULATION OF NOTCH SIGNALING PATHWAY%GOBP%GO:0045747	POSITIVE REGULATION OF NOTCH SIGNALING PATHWAY%GOBP%GO:0045747		29	0.37826866	1.064253	0.3706816	0.6720355	1.0	2566	tags=31%, list=14%, signal=36%	
CHAPERONIN-MEDIATED PROTEIN FOLDING%REACTOME DATABASE ID RELEASE 91%390466	CHAPERONIN-MEDIATED PROTEIN FOLDING%REACTOME DATABASE ID RELEASE 91%390466		84	0.31907818	1.0641605	0.34224138	0.67191726	1.0	1214	tags=10%, list=6%, signal=10%	
DNA DAMAGE RESPONSE%WIKIPATHWAYS_20250210%WP707%HOMO SAPIENS	DNA DAMAGE RESPONSE%WIKIPATHWAYS_20250210%WP707%HOMO SAPIENS		57	0.33603936	1.0637945	0.35752687	0.6725011	1.0	5149	tags=39%, list=27%, signal=53%	
TGF_BETA_RECEPTOR%IOB%TGF_BETA_RECEPTOR	TGF_BETA_RECEPTOR%IOB%TGF_BETA_RECEPTOR		119	0.30041525	1.0635759	0.3164557	0.67271113	1.0	1978	tags=12%, list=10%, signal=13%	
RHO GTPASES ACTIVATE PAKS%REACTOME%R-HSA-5627123.4	RHO GTPASES ACTIVATE PAKS%REACTOME%R-HSA-5627123.4		21	0.41378382	1.0630585	0.37082937	0.67371863	1.0	3270	tags=33%, list=17%, signal=40%	
RET SIGNALING%REACTOME%R-HSA-8853659.7	RET SIGNALING%REACTOME%R-HSA-8853659.7		33	0.37856928	1.0630431	0.37453532	0.6733877	1.0	3824	tags=42%, list=20%, signal=53%	
NEGATIVE REGULATION OF WNT SIGNALING PATHWAY%GOBP%GO:0030178	NEGATIVE REGULATION OF WNT SIGNALING PATHWAY%GOBP%GO:0030178		124	0.3003464	1.0628955	0.3159636	0.67340297	1.0	3074	tags=26%, list=16%, signal=31%	
NUCLEAR EVENTS STIMULATED BY ALK SIGNALING IN CANCER%REACTOME DATABASE ID RELEASE 91%9725371	NUCLEAR EVENTS STIMULATED BY ALK SIGNALING IN CANCER%REACTOME DATABASE ID RELEASE 91%9725371		27	0.39411512	1.0626342	0.37145558	0.6737216	1.0	4395	tags=33%, list=23%, signal=43%	
SPERMATID DEVELOPMENT%GOBP%GO:0007286	SPERMATID DEVELOPMENT%GOBP%GO:0007286		101	0.30590847	1.0626116	0.33482543	0.6734103	1.0	2449	tags=18%, list=13%, signal=20%	
POSITIVE REGULATION OF PEPTIDYL-TYROSINE PHOSPHORYLATION%GOBP%GO:0050731	POSITIVE REGULATION OF PEPTIDYL-TYROSINE PHOSPHORYLATION%GOBP%GO:0050731		51	0.3445597	1.0621455	0.3526745	0.67426866	1.0	2011	tags=22%, list=11%, signal=24%	
GABA RECEPTOR ACTIVATION%REACTOME%R-HSA-977443.7	GABA RECEPTOR ACTIVATION%REACTOME%R-HSA-977443.7		40	0.357205	1.0620418	0.3626272	0.67417413	1.0	2623	tags=25%, list=14%, signal=29%	
NEGATIVE REGULATION OF ENDOTHELIAL CELL APOPTOTIC PROCESS%GOBP%GO:2000352	NEGATIVE REGULATION OF ENDOTHELIAL CELL APOPTOTIC PROCESS%GOBP%GO:2000352		19	0.4250953	1.061649	0.37438905	0.6748606	1.0	1022	tags=21%, list=5%, signal=22%	
PATTERN SPECIFICATION PROCESS%GOBP%GO:0007389	PATTERN SPECIFICATION PROCESS%GOBP%GO:0007389		172	0.28627968	1.0611917	0.31162408	0.67569727	1.0	2033	tags=16%, list=11%, signal=17%	
LPA RECEPTOR MEDIATED EVENTS%PATHWAY INTERACTION DATABASE NCI-NATURE CURATED DATA%LPA RECEPTOR MEDIATED EVENTS	LPA RECEPTOR MEDIATED EVENTS%PATHWAY INTERACTION DATABASE NCI-NATURE CURATED DATA%LPA RECEPTOR MEDIATED EVENTS		60	0.3331814	1.0611482	0.35635358	0.67544484	1.0	2630	tags=23%, list=14%, signal=27%	
MORPHOGENESIS OF EMBRYONIC EPITHELIUM%GOBP%GO:0016331	MORPHOGENESIS OF EMBRYONIC EPITHELIUM%GOBP%GO:0016331		44	0.35181215	1.0610046	0.375802	0.67546415	1.0	2764	tags=27%, list=15%, signal=32%	
EFFECT OF OMEGA 3 PUFA ON HUNTINGTON 39 S DISEASE PATHWAYS%WIKIPATHWAYS_20250210%WP5470%HOMO SAPIENS	EFFECT OF OMEGA 3 PUFA ON HUNTINGTON 39 S DISEASE PATHWAYS%WIKIPATHWAYS_20250210%WP5470%HOMO SAPIENS		79	0.32027858	1.0606778	0.34491748	0.67595726	1.0	1419	tags=14%, list=8%, signal=15%	
GLUTAMINE FAMILY AMINO ACID CATABOLIC PROCESS%GOBP%GO:0009065	GLUTAMINE FAMILY AMINO ACID CATABOLIC PROCESS%GOBP%GO:0009065		15	0.4495292	1.0606145	0.38313007	0.67574984	1.0	2259	tags=33%, list=12%, signal=38%	
